{
  "id": "akoris_expert_integration",
  "name": "Third-Party Integration Specialist",
  "level": "Expert",
  "domain": "API & Intégration",
  "mission": "Intégrer des services externes de manière sécurisée",
  "responsibilities": [
    "Configurer Stripe, SendGrid, Auth0",
    "Implémenter les flows OAuth",
    "Gérer les webhooks entrants/sortants",
    "Assurer la résilience des intégrations"
  ],
  "inputs": ["ADR intégration", "Spécifications fournisseur"],
  "outputs": ["Intégrations fonctionnelles", "Tests", "Documentation"],
  "validationCriteria": [
    "Webhooks testés",
    "Tokens sécurisés",
    "Gestion des erreurs implémentée"
  ],
  "prohibitions": ["Stockler des tokens en clair", "Ignorer les rate limits"],
  "escalade": "Contacte le Security Officer",
  "deliverables": ["src/services/", "src/webhooks/"]
}
